"id","category","name","min_players","max_players","average_player_suggestions","player_suggestions","playing_time","rating_average_weight","how to play","mechanics"
"68448","Economic","7 Wonders","2","7","4","[<boardgamegeek.objects.games.PlayerSuggestion object at 0x13d710910>, <boardgamegeek.objects.games.PlayerSuggestion object at 0x13d7102d0>, <boardgamegeek.objects.games.PlayerSuggestion object at 0x13d7111d0>, <boardgamegeek.objects.games.PlayerSuggestion object at 0x13d711360>, <boardgamegeek.objects.games.PlayerSuggestion object at 0x13d710550>, <boardgamegeek.objects.games.PlayerSuggestion object at 0x13d711ef0>, <boardgamegeek.objects.games.PlayerSuggestion object at 0x13d6caa80>, <boardgamegeek.objects.games.PlayerSuggestion object at 0x13d6caee0>]","30","2.3146","game overviewa game begins with age i, continues with age ii and ends with age iii. vic-tory points are counted only at the end of age iii.overview of an ageat the beginning of each age, each player receives a hand of 7 cards, dealt randomly, from the corresponding deck.each age is made up of 6 game turns. during each turn the players put into play a single card, simultaneously.a game turn takes place as follows :•  1. choose a card•  2. action•   3. give your hand of cards to the player sitting to your left or right and receive another hand of cards from the player sitting next to you.1. choose a cardeach player looks at their hand without showing it to other players and selects a card before placing it face down before them.the remaining cards are placed between their left-hand neighbor and themselves (see end of an age).2. actiononce every player has selected his or her card, they perform their action simultaneously.three actions are possible with the chosen card :•  a. build the structure•  b. build a stage of their wonder•  c. discard the card to gain 3 coinsnote : during your ﬁ rst game, you can follow the action of each player, one after the other, to become more familiar with the game...2.a. build the structuremost often, the player will build the structure represented by the selected card (see construction in 7 wonders).important : a player can never build two identical structures (meaning those with the same name/the same illustration).card placementthe brown and gray cards are placed beneath one another starting from the upper left corner of the wonders board. this allows players to quickly see all resources produced by each player.the other cards are placed face up, in the area in front of the player’s wonders board. all of this area corresponds to a player’s city.in order to save space, stack your cards by color while leaving the name of each structure visible.2.b. build a stage of a wonderto build each stage of his or her wonder, the player will use a card of their choice as a construction marker :to do that, the player must pay the price shown on the wonder board and not the one shown on the structure’s card.the player then plays the card, face down, half hidden under the wonder board to show that this stage of their wonder is now built. the card then has no other effect, and is not considered to be a structure.example : a player wants to build the second stage of his wonder, the lighthouse of alexandria. he chooses one card from his hand. his city grants him the two units of ore required for his construction, he the-refore places his card in front of the wonder stage, half covered by his board in order to indicate that this stage has been constructed.clariﬁ cation :•   the stages of a wonder must be built in order, meaning from left to right.•   the construction of the wonder is not mandatory. a player can win the game without having ﬁ nished (or even started) the construction of his or her wonder.•   the card used to mark the construction of a wonder stage remains hidden. players would be advised to use a card they do not want to give their neighbor (see move on to the next hand).•   most wonders have 3 stages but these are not associated with ages. it is therefore possible to build multiple wonder stages in a single age or to begin construction during age iii.•   each stage can only built once per game.2.c. discard the card to gain 3 coinsa player can choose to discard his or her card to take 3 coins from the bank and add them to his or her treasury.the cards discarded this way remain face down and form a discard pile in the center of the table. it can be useful to discard a card you cannot build but which would be of interest to your neighbor.note : if a player has chosen a card but is unable to build either the struc-ture or the wonder stage, that player is then forced to discard the card and takes 3 coins from the bank.3. move on to the next handeach player takes the hand of cards handed from his or her neighbor.be careful : the direction of the hands rotation changes with each age :· 5 ·end of the gamethe game ends at the end of the third age, after the conﬂ ict tokens have been handed out.each player totals their civilization points and the player with the highest total is declared the winner.in case of a tie, the player with the most coins in his or her treasury is the winner. a tie on coins is not broken further.note : a booklet of scorecards is in the box to help you count the points for your ﬁ rst few games... or keep track of your more memorable games !totalling the pointscount the victory points in this order :•  1. military conﬂ icts•  2. treasury contents•  3. wonder•  4. civilian structures•  5. scientiﬁ c structures•  6. commercial structures•  7. guilds1. military conﬂ ictseach player adds their victory and defeat tokens (this total can be negative !).example : alexandria has ﬁ nished the game with the following tokens : +1, +3, +5, -1, -1, -1 for a total of 6 points.2. treasury contentsfor every 3 coins in their possession at the end of the game, players score 1 victory point. leftover coins score no points.example : alexandria has ﬁ nished the game with 14 coins in their treasury, which earns them 4 victory points (4 sets of 3 coins plus one partial set).3. wonderseach player then adds to their score the victory points from their wonder.example : alexandria has built all 3 stages of their wonder (side a) ; 10  victory points (3 for the ﬁ rst phase and 7 for the third) are added to their total.4. civilian structureseach player adds the victory points of their civilian structures. this amount is indicated on each civilian structure.example : alexandria has built the following civilian structures : altar (2vp), aqueduct (5vp) and town hall (6vp) for a total of 13 victory points.5. scientiﬁ c structuresthe scientiﬁ c cards earn victory points in two very different ways : from sets of identical symbols and from sets of 3 different symbols.be careful : the victory points earned by both methods are cumulative.sets of identical symbolsfor each of the 3 existing scientiﬁ c symbols, the player wins the following points :•  only 1 symbol : 1 victory point•  2 identical symbols : 4 victory points•  3 identical symbols : 9 victory points•  4 identical symbols : 16 victory pointsnote :- the number of points gained is equal to the number of symbols squared.- there are 4 green cards for each symbol, for a maximum of 16 victory points per family of symbols.- this maximum can be increased with the scientiﬁ c guild and the won-der of babylon : 5 identical symbols earn 25 victory points and 6 identi-cal symbols earn 36 victory points.example : alexandria has built 6 scientiﬁ c structures with the following symbols : 3 3 , 2 2 , 1 1 . they score 9 points for the family of 3 3  (3x3), 4 points for its  (1x1), for a total of 14 victory points. (2x2) and ﬁ nally 1 for the sets of 3 different symbolsfor each group of 3 different symbols, each player scores 7 victory points.example : continuing the above example, alexandria has built 6 scien-tiﬁ c structures but only has a single group of 3 different symbols, they score 7 extra points for a total of 21 victory points.if alexandria had built an extra structure with the would’ve scored : (9 + 4 + 4) + (7 + 7) = 31 victory points. symbol, they 6. commercial structuressome commercial structures from age iii grant victory points.example : alexandria has built the chamber of commerce. this structure is worth 2 victory points for each gray card present in their city. alexan-dria has played two gray cards : 4 victory points.7. guildseach guild is worth a number of victory points depending on the conﬁ gu-ration of the player’s city and/or that of the two neighboring cities (see description of the structures).strategic advices•  block your opponents : to win at 7 wonders, you must keep an eye on your two neighboring cities to analyze their strategy. try to block them by using the cards which would give them an advantage. you can use them to build your wonder stages or by discarding them when you need coins.•  strategies : multiple strategies can lead to victory : specialize in struc-tures of a single color or collect the different types of structures, wage war or neglect your military, producing goods in abundance or rely on commerce...•  the march of progress : if you build scientiﬁ c structures, try to make groups of different symbols, as they tend to earn more points.· 6 ·“expert” variant for 2 playersthe following rule adjustments allow play with 2 players.in addition to the standard game material, you’ll need the two speciﬁ c cards found in the box.be careful : we suggest you play a few games with 3-7 players before trying the game in its 2-player variant !1. choose a cardthe player who holds the free city card in his or her hand takes the ﬁ rst card of the draw pile and adds it to their hand.that player will then choose two cards from his or her hand – one for their own city and one for the free city, while his or her opponent chooses their card normally.each player then places the remaining cards on their side of the border card.border cardborder cardfree city cardgame set-upthe players use the same cards as in the 3-player conﬁ guration (3+ cards only).each player is given a board, and then a third board is placed beside them. this board will be called the free city in the rest of this variant.the border card is placed between the two players.each player is given a 7-card hand and the remaining 7 cards make a draw pile, placed face down, to the right of the border card.the player to the left of the free city adds the free city card to his or her hand.the players and the free city each get 3 coins from the bank to start the game.game overviewthe game proceeds the same way as it would with 3 to 7 players.the difference is in the management of the free city : the players will play, in turn and in addition to their own card, a card for it.2. actionthe player holding the free city card plays the free city’s card followed by his or her own while their opponent performs their own action.rules for the free city :•   the free city can purchase resources from both of its neighboring cities as according to the commerce rules. when a resource is avai-lable in both neighboring cities, the player who controls the free city is free to purchase from either one, even if the cost would be less if bought from one player.•   the free city can only discard a card to earn 3 coins if it cannot play one (building structures or a wonder stage).•   if the card chosen for the free city can beneﬁ t from a free construc-tion (chain), this free construction must be performed.note : during the sixth turn of the age, there is only one card remaining in the free city’s draw pile. this last card is discarded at the same time as the seventh and last card of the players.carte cité francheat the end of the turn, ludovic put his cards hereat the end of the turn, pierôput his cards hereborder cardcard played by ludovic for his city3. move on to the next handonce all three cards are played, the players take the stack of cards on the other side of the border. during the next turn, it’s the other player who’ll play for the free city, and so on until the end of the game.example : ludwig and peter start a game. they each get a hand of 7 cards and place a draw pile made up of the 7 remaining cards 7 to the right of the border card. ludwig, to the right of the free city, adds to his hand the free city card. on the ﬁ rst turn of the game, peter chooses one card from his hand to play and ludwig takes the ﬁ rst card of the free city draw pile and adds it to his hand. he then chooses one card for the free city and one for his own city. the players reveal their chosen cards, starting with the free city and play them. then they take the stack of cards on the other side of the border card, so peter winds up with the free city card for the second turn of the game. it’s therefore up to him to draw a card and play for both his city and the neutral city...end of an agethe player who begins with the free city card changes each age :•  age i : the card is held by the player to the left of the free city.•  age ii : the card is held by the player to the right of the free city.•  age iii : the card is held by the player to the left of the free city.the rules for conﬂ ict resolution remain unchanged.","['Closed Drafting', 'End Game Bonuses', 'Hand Management', 'Melding and Splaying', 'Multi-Use Cards', 'Neighbor Scope', 'Once-Per-Game Abilities', 'Score-and-Reset Game', 'Set Collection', 'Simultaneous Action Selection', 'Tags', 'Tech Trees / Tech Tracks', 'Variable Player Powers', 'Variable Set-up']"
"63628","Economic","The Manhattan Project","2","5","4","[<boardgamegeek.objects.games.PlayerSuggestion object at 0x13d72ed50>, <boardgamegeek.objects.games.PlayerSuggestion object at 0x13d72d130>, <boardgamegeek.objects.games.PlayerSuggestion object at 0x13d72d9f0>, <boardgamegeek.objects.games.PlayerSuggestion object at 0x13d72c050>, <boardgamegeek.objects.games.PlayerSuggestion object at 0x13d72fe80>, <boardgamegeek.objects.games.PlayerSuggestion object at 0x13d72c7d0>]","120","2.9556","how to play overview a revolutionary new technology has been discovered. every major military power recognizes its destructive potential. can your nation lead the arms race and become the world’s dominant superpower? objective score points by building, testing, and loading nuclear bombs. the first nation to reach the victory point goal wins. victory point goals by player count • 2 players: 70 points • 3 players: 60 points • 4 players: 50 points • 5 players: 45 points game components • 1 main board • 5 player boards (one per player color) • 5 fighter counters (one per player color) • 5 bomber counters (one per player color) • 50 building cards (6 starting, 44 regular) • 30 bomb cards • 48 money coins (38 × $1, 10 × $5) • 10 loaded bomb markers • 16 damage markers (double-sided) • 15 player color discs • 40 yellowcake cubes • 72 workers: 24 laborers, 24 scientists, 24 engineers (each with 4 per player color + 4 grey contractors) • 12 grey contractors • 5 implosion test counters setup 1.  board & general supply • place the main board centrally. • place player tokens on the bottom space of the plutonium, enriched uranium, and espionage tracks. • general supply includes building cards, bomb cards, loaded bomb markers, damage markers, money, yellowcake, contractors, and workers. • sort implosion test counters by player count (use only those needed). 2.  building market • shuffle 6 starting buildings (red backs) and place them face up in the first 6 market   spaces. • shuffle 44 regular buildings, place the top card face up on the $20 space; return the rest to the general supply. 3.  bomb cards • shuffle 30 bomb cards. • draw (players + 1) face-up cards for the development row; return the rest face down to the general supply. 4.  player supplies • each player chooses a color and places their player board. • each player takes 4 laborers, $10, 1 fighter counter on “1” track, and 1 bomber counter on “1” track. 5.  starting bonus (based on turn order) • player 1: none • player 2: $2 • player 3: $4 • player 4: $2 + 1 scientist or engineer • player 5: $4 + 1 scientist or engineer player turn on your turn, choose one option: 1.  place workers • step 1: place on main board • step 2: place on your buildings (repeatable) • optional but must place at least 1 worker 2.  retrieve workers • step 1: return permanent workers from main board • step 2: return workers from buildings, bombs, implosion counters • step 3: return contractors to general supply • must retrieve at least 1 permanent worker workers laborers, scientists, and engineers can be permanent (player color) or contractors (grey). worker placement • workers can be placed on main board spaces or buildings. • must meet worker type and resource requirements. special placement rules • construction: unlimited; may place multiple workers. engineers can build the cheapest buildings for free. • university: produces workers. • mines: produce yellowcake. • factories: produce money and/or aircraft.   • reactor: produces plutonium. • enrichment plant: produces enriched uranium. air strikes • fighters destroy enemy aircraft. • bombers damage enemy buildings (cannot attack if opponent has fighters). repair space • pay $5 to repair up to 3 damage points; damage counters returned to general supply. espionage • pay $3 to gain a spy; can place workers on opponents’ buildings equal to spy count. bomb actions 1.  build bomb • requires bomb card, workers, and fuel (plutonium/enriched uranium). • place workers on bomb card, spend fuel from main board track. • score points shown on bomb card. 2.  implosion test (plutonium bombs only) • place bomb card face down, take highest value implosion counter. • lose original bomb points; all plutonium bombs now worth higher points. • only one test per game. 3.  load bomb • pay loading cost, reduce bomber counter by 1. • place loaded bomb marker → gain 5 victory points. game end • the game ends immediately when a player reaches the target victory points. examples of actions • worker placement example: place engineers on factory → produce bombers/money. • air strike example: use fighters to destroy opponent aircraft; bombers to damage buildings. • bomb build example: assign workers and fuel → score points. • implosion test example: test plutonium bomb → gain higher points for all plutonium bombs. • load bomb example: pay cost, reduce bomber → gain 5 points.      ","['Action Retrieval', 'Auction: Dutch Priority', 'Closed Drafting', 'Race', 'Take That', 'Worker Placement', 'Worker Placement, Different Worker Types']"
"63268","Educational","Spot it!","2","8","5","[<boardgamegeek.objects.games.PlayerSuggestion object at 0x13d72ec10>, <boardgamegeek.objects.games.PlayerSuggestion object at 0x13d78cc30>, <boardgamegeek.objects.games.PlayerSuggestion object at 0x13d78c460>, <boardgamegeek.objects.games.PlayerSuggestion object at 0x13d78e440>, <boardgamegeek.objects.games.PlayerSuggestion object at 0x13d78f980>, <boardgamegeek.objects.games.PlayerSuggestion object at 0x13d78c410>, <boardgamegeek.objects.games.PlayerSuggestion object at 0x13d78d680>, <boardgamegeek.objects.games.PlayerSuggestion object at 0x13d7cf200>, <boardgamegeek.objects.games.PlayerSuggestion object at 0x13d7cf250>]","15","1.0388","playwhen you find the match, try to…- identify the number as odd or even.- double the number.- count backward from the number to zero.- count forward from the number to 10. - find an object that contains the shape. - say the shape’s number of sides. - spell the color of the shape or number.game published and distributed under license  by divertis properties group.original dobble game created by playfactory.  spot it! numbers & shapes version created  and developed by blue orange games.list of symbolslist of symbolsblue zeroblue zeroyellow fiveyellow fiveyellow triangleyellow trianglepurple zeropurple zeropurple fivepurple fivered onered onepurple sixpurple sixred trianglered triangleblue oneblue oneyellow sixyellow circleyellow sixyellow circlepurple rectanglepurple rectangleorange twoorange twoblue sevenblue sevenblue triangleblue trianglered twored twored sevenorange circlered sevenorange circlered rectanglered rectanglegreen threegreen threered eightred eightgreen squaregreen squareorange threeorange threeorange eightorange eightgreen circle orange rectanglegreen circle orange rectanglepurple fourpurple fourgreen ninegreen ninepurple squarepurple squaregreen fourgreen fouryellow nineyellow nine     game n1) preparing the game: place all the cards face-down in a pile.2) object of the game: to collect the most cards.3) playing the game:   one player takes the first 2 cards from the pile  and places them, at once, face-up on the table.then, at the same time, all players try to find  the matching symbol on both cards. as soon as you find the match, call it out (example: “purple six!”)  and take the 2 cards you’ve won. reload 2 new cards from the pile.setting up: © 2012 blue orange. all rights reservedforallcountries.numbers & shapesgame n21) preparing the game: shuffle the cards and deal  one card face-down to each player. place the remaining cards  face-up in the middle of the table to form the draw pile. 2) object of the game: to collect the most cards.© 2012 blue orange. all rights reservedforallcountries.numbers & shapessetting up:  (example for 3 players)© 2012 blue orange. all rights reserved for all countries.sepahs&srebmunnumbers & shapesgame n 3©2012bueorangle. all rights reserved for all countries.1) preparing the game: place one card face-up  in the middle of the table. shuffle and deal the remaining  cards face-down to all the players.  these cards form their personal draw piles.2) object of the game:  to be the first player to get rid of all your cards.setting up:   (example for 3 players)© 2012 blue orange. all rights reserved for all countries.© 2012 blue orange. all rights reserved for all countries.© 2012 blue orange. all rights reserved for all countries.© 2012 blue orange. all rights reserved for all countries.sepahs&srebmunsepahs&srebmunsepsaehpsah&ssr&esbrmebumnunnumbers & shapesnumbers & shapesnumbers & shapes© 2012 blue orange. all rig© 2012 blue orange. all rig© 2012 blue orange. all rights rehts rehts reservedforallservedforallservedforallcountries.countries.countries.numbers & shapesnumbers & shapesnumbers & shapes©2012bueorangle. all rigl©2012©b2u0e12orbanugeorangle. all rige. all rights reserved for all countries.hts reserved for all countries.hts reserved for all countries.4) winning the game: when there are fewer than 2 cards in the pile,  the game ends and the player with  the most cards wins.3) playing the game:  at the same time, players flip over their cards. they try to spot the one symbol that appears both on  the center card and on their own card.if you are the first player to do so  call it out (example: “red rectangle!”).  then take the center card and place it  face-up on top of your flipped card, building a personal pile. now use the new top card on your personal pile to find a match with the center card. repeat this process each  time a new center card is revealed. play continues until no cards  remain in the draw pile. 4) winning the game: the player with the most cards wins.3) playing the game: at the same time, players flip their entire draw piles over so they are face-up. if you are the first player to spot the symbol that appears both on your top card and on the center card, call it out (example: “orange two!”)  and place your card on top of the center card. it becomes the new center card which players use to try to find a match.  use the new card revealed on your personal pile to find  a match with the center card. play continues until  one player runs out of cards.4) ","['Hot Potato', 'Pattern Recognition', 'Speed Matching']"
