"id","category","name","min_players","max_players","average_player_suggestions","player_suggestions","playing_time","rating_average_weight","how to play","mechanics"
"312484","Adventure","Lost Ruins of Arnak","1","4","3","[<boardgamegeek.objects.games.PlayerSuggestion object at 0x13d72f480>, <boardgamegeek.objects.games.PlayerSuggestion object at 0x13d72f9d0>, <boardgamegeek.objects.games.PlayerSuggestion object at 0x13d72c500>, <boardgamegeek.objects.games.PlayerSuggestion object at 0x13d72eb20>, <boardgamegeek.objects.games.PlayerSuggestion object at 0x13d72e850>]","120","2.9332","how to play objective: lead an expedition to explore the uncharted island of arnak and uncover the secrets of a lost civilization. over five rounds, players will explore sites, acquire items and artifacts, overcome guardians, and advance their research to score the most points. game overview the game is played over five rounds. each round follows this sequence: 1.  draw cards – each player draws until they have five cards in hand. 2.  take turns – starting with the first player, players take turns clockwise, performing one main action and any number of free actions. 3.  pass – a player may pass when finished taking actions for the round. once all players have passed, the round ends. 4.  end of round setup – o  return archaeologists to your board. o  gain fear cards for archaeologists returning from sites with guardians. o  shuffle cards in your play area and put them under your deck. o  refresh assistants. o  adjust the card row and move the moon staff to mark the next round. o  pass the starting player marker to the left. 5.  after five rounds, the game ends and players proceed to final scoring. your turn on your turn, you may perform one main action and any number of free actions. main actions include: •  dig at a site – send an archaeologist to an available site and resolve its effect. •  discover a new site – pay travel and compass costs to explore a new site and awaken a guardian. •  overcome a guardian – pay the guardian’s cost to gain its boon and 5 end-game points. •  buy a card – purchase an item (with coins) or an artifact (with compasses). •  play a card – use a card’s effect (main or free action).    •  research – advance on the research track to gain bonuses and assistants. •  pass – end your participation for the round. free actions: •  cards and effects marked as free actions (lightning icon) can be used at any time, even during another action. •  assistants and idols may also provide free actions. ","['Area Movement', 'Contracts', 'Deck, Bag, and Pool Building', 'Delayed Purchase', 'End Game Bonuses', 'Hand Management', 'Multi-Use Cards', 'Once-Per-Game Abilities', 'Open Drafting', 'Resource to Move', 'Solo / Solitaire Game', 'Track Movement', 'Turn Order: Progressive', 'Worker Placement']"
"100423","Adventure","Elder Sign","1","8","5","[<boardgamegeek.objects.games.PlayerSuggestion object at 0x13d6c8e60>, <boardgamegeek.objects.games.PlayerSuggestion object at 0x13d6ca9e0>, <boardgamegeek.objects.games.PlayerSuggestion object at 0x13d6ca620>, <boardgamegeek.objects.games.PlayerSuggestion object at 0x13d6c9540>, <boardgamegeek.objects.games.PlayerSuggestion object at 0x13d6c8b40>, <boardgamegeek.objects.games.PlayerSuggestion object at 0x13d6cb7a0>, <boardgamegeek.objects.games.PlayerSuggestion object at 0x13d6ca350>, <boardgamegeek.objects.games.PlayerSuggestion object at 0x13d72df40>, <boardgamegeek.objects.games.PlayerSuggestion object at 0x13d72e080>]","90","2.3438","player turn order1. movethe player may move to an adventure/other world or entrance card. if the card lists entry, resolve the effect if the investigator moved there on this turn.2a. resolve an adventureif on an adventure or other world card, the player may attempt to complete the task on his card. to do so, he rolls the green dice (plus any yellow or red dice if spending an item that adds these dice).a player may only complete a single task on any given roll. if there is an arrow next to the tasks, they must be completed in top-down order.if successful, he places the corresponding dice on the completed task and then rolls the remaining dice to attempt to complete the next task, if any. once all tasks have been successfully completed on the same turn, he succeeds and gets the rewards (in green, lower right corner of the card). he claims the card as a trophy, returns to the entrance (souvenir shop), replaces the adventure card with a new one, and then resolves any reward effects.if failed, he must remove one die. if a die shows a terror result and the card (or mythos) has a terror effect, he takes that penalty immediately. he may use the focus or assist ability and attempt the task again with the remaining dice. if he cannot or chooses not to attempt it, he takes the penalty (in red, lower left corner of the card). assisting investigators lose 1 stamina or sanity.2b. wait at the entranceif on an entrance sheet or card, the player may perform a listed task. return spent monsters to the cup and cards to the bottoms of their decks. if the entrance card is closed (face down), he still may go there but not take actions.3. advance the clockthe player advances the clock 3 hours (to iii, vi, ix, xii). if the clock advances to midnight (xii), at the end of that turn, effects that state at midnight on any cards all take effect. he then draws and resolves a new mythos card, replacing the old one. immediate effects occur right away; lingering effects last until the next midnight. the player to the last player’s left now takes his turn.battling the ancient onethe ancient one awakens when the doom track is full (if earlier, fill the track). all investigators move to the its card. ignore mythos for the rest of the game. a player in turn can attempt (as above) to resolve the card’s combat task as often as possible on his turn. each success removes one doom token. he then advances the clock. the ancient one attacks (per its card) each midnight.symbol referencereward and penalty reference gain common item  gain unique item  gain spell gain clue  gain ally  add other world card gain elder sign  lose 1 stamina  lose 1 sanity add 1 monster become blessed  become cursed advance clock  add a doom token  remove a doom tokentask referencetotal value of rolled investigations required to complete this taskterror (if the attempt fails, resolve any terror effect on that adventure or mythos)loreperilsplit (either die result counts as a success)advance the clock 3 hours after completing this tasklose the indicated amount of sanity after completing this taskgain a curse die after completing this tasklose the indicated amount of stamina after completing this taskadd a doom token to the doom track after completing this taskother symbolslocked die: place the corresponding die on this card until the card is resolvedtrophy value of the claimed card or monsterarrow: tasks must be completed in top-down orderwild card (red die only): may be used as lore, peril, terror, or 4 investigationmonster order arrow: when this monster is placed on a card, tasks on this card must now be done in top-down order (regardless of where on the card the monster is placed)mythos insightif the mythos card shows the mythos insight icon, the players choose which of the two effects takes place (only if both could have an effect). setup and other rules","['Cooperative Game', 'Dice Rolling', 'Die Icon Resolution', 'Modular Board', 'Re-rolling and Locking', 'Solo / Solitaire Game', 'Variable Player Powers']"
"328908","Adventure","The Initiative","1","4","3","[<boardgamegeek.objects.games.PlayerSuggestion object at 0x13d6a9400>, <boardgamegeek.objects.games.PlayerSuggestion object at 0x13d6ab6b0>, <boardgamegeek.objects.games.PlayerSuggestion object at 0x13d6a9a90>, <boardgamegeek.objects.games.PlayerSuggestion object at 0x13d72e1c0>, <boardgamegeek.objects.games.PlayerSuggestion object at 0x13d72e2b0>]","60","2.0164","how to play after setup, the first player who volunteers goes first. play proceeds clockwise. turn overview on your turn: 1.  perform one or two actions. 2.  refill your hand to four cards by drawing from the resource deck. then the next player takes their turn. continue taking turns until the group either wins or loses the mission. communication rules you may only look at your own hand of resource cards. you can discuss your cards, but you cannot reveal their exact values. for example, you may say “i have three high cards,” but not “i have a 12.” performing actions to perform an action, play one resource card from your hand face up onto one of the four action cards (run, gather, intel, regroup). then resolve that action’s ability. •  you may perform one or two actions per turn. •  you must perform at least one action, even if it has no effect. •  you can only play a resource card if its value is higher than the top card already on that action card’s pile. •  the color (suit) of the resource card normally has no effect. action cards run move your standee up to three rooms, one at a time, along connected passageways. you cannot move through walls.     gather collect up to two clue tokens from your current room. •  you can collect face-up clue tokens showing a glyph that appears on the mission card. •  when you collect a glyph, remove the token and flip up all matching windows on • the mission console. instead of collecting a face-up clue, you may flip and immediately collect the facedown token on top of the stack in your room. intel choose a room and reveal up to two clue tokens in it, one at a time. you don’t need to be in that room. if a revealed glyph doesn’t appear on the mission card, remove it from the board. regroup choose any other action card and discard all resource cards and tokens on it. you cannot use regroup to clear itself. special actions instead of using an action card, you may use your character’s special action: •  discard any two cards from your hand to resolve your character’s special ability. •  you may do this once or twice per turn (discarding four cards to do it twice). nearby some abilities affect nearby components — these include all components in your room and in adjacent rooms. traps some clue tokens are traps instead of glyphs. when revealed: •  brown traps remain in the room. •  yellow traps have an immediate effect, then are discarded. examples:    •  security camera: stays in the room; at the end of your turn, discard one card from the top of the resource deck for each camera in your room. •  gas: all players in the room discard one random card. •  counter intel: blocks the matching action card until cleared by regroup. ","['Area Movement', 'Cooperative Game', 'Deduction', 'Scenario / Mission / Campaign Game', 'Variable Player Powers']"
"285192","Adventure","Destinies","1","3","2","[<boardgamegeek.objects.games.PlayerSuggestion object at 0x13d6e3660>, <boardgamegeek.objects.games.PlayerSuggestion object at 0x13d6cb700>, <boardgamegeek.objects.games.PlayerSuggestion object at 0x13d6ca5d0>, <boardgamegeek.objects.games.PlayerSuggestion object at 0x13d6c9900>]","150","1.9273","game flowplayers take turns, passing the device from one to another. all narrative events and information gained during play are public and read aloud. a player’s turn has 3 steps performed in order:1. start of the turnrefresh 1 effort die by moving it from the table onto the supply area of your player board. refreshed dice may be used during any upcoming test.most game events trigger at this step of your turn.2. movementyou may choose to stay on your current tile, or move your character miniature to any tile up to 2 tiles away, counting orthogonally (no diagonal movement). you may move onto an unexplored tile, but must immediately stop moving there. after moving to an explored tile, you may visit 1 point of interest (represented by a token or miniature) on that tile.when taking a test, you must roll your 2 main dice. optionally, you may also roll all, some, or none of your effort dice. when an effort die is used, it is exhausted (removed from your supply). total the numbers on all rolled dice and compare  this with your skill markers on the relevant skill track. for each skill marker on a number less than or equal  to the roll total, you score 1 success. for each automatic success die result (the star on an effort die), you also score a success.a test never needs more than 6 successes.enter your total number of successes into the app, which then tells the result. this may include storyline changes, experience points gained by the player, items gained by the player, and/or skill gain/loss.scanning item cards you may have the option to scan your items. the app indicates whether a particular scan represents talking about the item with an npc or using the item some way. scanning a destiny card when talking to npcs, you have an option to ask them about your destiny.  scanning your destiny card when you talk to an npc represents sharing your story with the npc, and usually results in getting hints about how to fulfill one’s destiny.if you wish to do so, scan the code of the specific destiny path you want to talk about (still keeping your destiny secret from other players).scan or test you may be given a choice of using an item or performing a test to achieve the same result. if you use the right item, the action automatically succeeds, but if you use the wrong item, it automatically fails. in contrast, a test gives a chance of success, depending on your skill markers and number of effort dice rolled. you can only try one of these 2 methods per turn.tradingwhen a point of interest offers a trading opportunity for the first time, the app will typically instruct players to create a trade stack by getting some specific item cards, plus any matching pair of trade stack tokens. one trade stack token goes next to the point of interest on the map, and its matching token goes on the item cards nearby which are available to buy. events during the game may cause new items to appear in trade stacks.the trade stack remains in play at that point of interest from then on; so if one player sells an item there, later another player can buy that item. similarly, when one player buys something, it becomes unavailable to others. item prices are equal to their printed value, both when buying and selling.during each trade a player may sell and buy any number of items.besides trading, players may also use money for  other purposes if the app allows it: paying coins to bribe, to repay debts, or even to throw coins somewhere. in cases like these, put used coins back into the general supply.experienceyou gain experience points as a result of certain interactions. at any moment during your turn, except during a test, you may spend your gained experience points to upgrade your skills. for each experience point spent, you may move any of your skill markers a total of 2 spaces left (either moving 1 marker 2 spaces left, or 2 different markers each 1 space left on the same track or on different tracks). there can never be 2 skill markers in the same space of a skill track.   skill gain and loss actions may result in you gaining or losing skill. the app instructs you to move your skill markers of a specified skill to the left (when gaining) or to the right (when losing). the app tells the total number of spaces to move, but you decide how to distribute these moves among your skill markers on that track. both skill loss and skill gain are permanent. some items let you lose some skill in exchange for some other reward. a specific skill may be lost, or you may be able to choose.some items and interactions may cause you to gain skills by moving skill markers to the left, the same way as when upgrading. itemseach player’s inventory is limited to 5 item cards. if you get more, you must get rid of excess items to reduce back to 5 immediately. you can either abandon an excess item, or use its discard ability and then discard it back to the box.when you abandon an item, place it near the map. take a pair of unused trade stack markers, put 1 marker onto the abandoned card, and the matching marker onto the map tile where the character is to shows where the item was dropped. from now on, any player who visits any point of interest on this map tile may, as a free action, pick up this item card and add it to their inventory.item special abilities are of 2 types: always, which means that the ability is active as long as the character has the item in their inventory, or discard, which means that to use the ability, the owning player must return the item card to the box.you may use your item abilities freely in any order during your turn. if an item ability does not specify the exact moment when it should be used, you are allowed to use it in any moment of their turn, as you wish.if it ever happens that the result of a player combining several actions seems ambiguous, choose the resolution most favorable for that player.eventswhen an event is triggered, the active player follows the app’s instructions. events may change the state of points of interest. such events might happen, for example, when an npc arrives at a location, or moves to another location. ","['Dice Rolling', 'Map Addition', 'Role Playing', 'Scenario / Mission / Campaign Game', 'Solo / Solitaire Game', 'Storytelling', 'Tile Placement']"
"15987","Adventure","Arkham Horror","1","8","5","[<boardgamegeek.objects.games.PlayerSuggestion object at 0x13d6e3390>, <boardgamegeek.objects.games.PlayerSuggestion object at 0x13d6e3750>, <boardgamegeek.objects.games.PlayerSuggestion object at 0x13d6e39d0>, <boardgamegeek.objects.games.PlayerSuggestion object at 0x13d6e3d40>, <boardgamegeek.objects.games.PlayerSuggestion object at 0x13d6e0d20>, <boardgamegeek.objects.games.PlayerSuggestion object at 0x13d6e13b0>, <boardgamegeek.objects.games.PlayerSuggestion object at 0x13d6ca580>, <boardgamegeek.objects.games.PlayerSuggestion object at 0x13d6cac10>, <boardgamegeek.objects.games.PlayerSuggestion object at 0x13d6caa30>]","240","3.585","play: investigators of arkham welcome to arkham! the year is 1926, and the city of arkham is alive with the energy of the roaring twenties. flappers dance in smoke-filled speakeasies, alcohol flows freely, and the city celebrates the end of the great war. yet a dark shadow grows. alien entities known as the ancient ones lurk beyond the boundaries of space and time. occult rituals must be stopped, and creatures of unimaginable horror destroyed, before the ancient ones make our world their ruined dominion. only a few brave investigators stand against the encroaching terror. will they prevail? game overview arkham horror is a cooperative board game for 1–6 players, playable in 2–3 hours. each player controls an investigator, exploring arkham, massachusetts—a town made famous by h.p. lovecraft’s cthulhu mythos. investigators encounter strange places, terrifying monsters, and cryptic clues. together, they must gather resources, solve mysteries, and prevent the rise of the ancient ones. cooperative play all players are on the same team. investigators win or lose together. use your unique abilities wisely to confront monsters, unravel mysteries, and protect arkham. learning how to play this guide introduces new players to arkham horror. it simplifies some complex rules and interactions. for full rules and exceptions, refer to the rules reference. sidebars sidebars provide context, diagrams, strategy tips, or additional narrative. game components investigator components: investigator sheet with abilities investigator token + plastic stand • • •  activation token •  reference card    game boards and cards: •  scenario sheet •  neighborhood tiles (12) •  street tiles (7) •  event cards (72) •  encounter cards (36) •  monster cards (62) • item, ally, spell, special, and condition cards tokens: •  clue/doom tokens (48) •  damage tokens (42) •  horror tokens (42) •  money tokens (40) •  remnant tokens (24) •  focus tokens (30) •  mythos tokens (18) •  activation tokens (6) dice: 6 dice for skill checks game setup 1.  choose scenario select one scenario sheet (e.g., approach of azathoth) and place it in the play area. return other sheets to the box. 2.  prepare board & encounters o  arrange neighborhood and street tiles as indicated on the scenario sheet. o  shuffle and prepare encounter decks for streets and neighborhoods in the scenario. 3.  prepare event deck shuffle the scenario’s event cards (24 for approach of azathoth) and place them facedown in the event deck holder. return other event cards to the box. 4.  prepare monster deck o  gather the monsters listed on the scenario sheet. o  place starting monsters on indicated spaces, ready side up. 5.  prepare mythos cup o  place the indicated mythos tokens into an opaque container. o  return unused tokens to the box. 6.  prepare headline deck o  shuffle all headline cards. o  draw 13 cards to form the scenario’s headline deck. 7.  prepare assets & display o  shuffle item, ally, and spell cards into separate decks. o  place top 5 items faceup to form the display. 8.  prepare token pools keep all tokens separated by type for easy access.  9.  prepare archive archive cards provide evolving narrative. keep them stacked in numerical order until instructed to use. 10. choose investigators o  each player selects an investigator sheet, token, activation token, and reference card. o  choose a group leader to take the leader activation token. 11. final preparations o  place starting clues from the event deck into neighborhoods. o  place starting doom on spaces indicated on the scenario sheet. o  resolve “finalize setup” effects from the scenario sheet (e.g., add cards #2 & #3 to the codex; prepare the anomaly deck). o  place all investigator tokens in their starting spaces (for approach of azathoth, the train station in northside). investigator actions each investigator can perform up to two actions per round (some only once per round). if engaged with a monster, only focus, attack, or evade actions are allowed. •  move: move up to 2 spaces; spend $2 to move additional spaces. •  gather resources: gain $1. •  focus: focus on one skill of your choice. •  ward: test a skill to remove doom from your space. gain a remnant for removing 2+. •  attack: engage one monster; roll dice to deal damage equal to successes. •  evade: attempt to disengage from monsters; if successful, may perform one extra action. •  research: test a skill to place clues on the scenario sheet. •  trade: exchange possessions with other investigators in your space. starting possessions each investigator receives starting cards and money tokens listed on their sheet. return unchosen or unused cards to the box. playing the game arkham horror is played over rounds, each consisting of four phases: 1.  action phase: investigators perform up to 2 actions each. 2.  monster phase: monsters move, attack engaged investigators, or ready if exhausted. 3.  encounter phase: investigators resolve encounters in their location, revealing narrative events. 4.  mythos phase: each investigator draws two mythos tokens, causing doom, monsters, or clues to spread.   the game then proceeds to the next round, starting again with the action phase. anomalies & outbreaks •  anomalies appear when doom accumulates in a neighborhood, triggering special encounters. •  outbreaks occur when a space has 4+ doom: remove 3 doom, distribute 1 doom to each other space in the neighborhood, and add 1 doom to the scenario sheet. ","['Cooperative Game', 'Dice Rolling', 'Events', 'Finale Ending', 'Hand Management', 'Lose a Turn', 'Point to Point Movement', 'Role Playing', 'Solo / Solitaire Game', 'Stat Check Resolution', 'Variable Player Powers']"
