"id","category","name","min_players","max_players","average_player_suggestions","player_suggestions","playing_time","rating_average_weight","how to play","mechanics"
"6830","Abstract","Zendo","2","6","4","[<boardgamegeek.objects.games.PlayerSuggestion object at 0x13d7ab340>, <boardgamegeek.objects.games.PlayerSuggestion object at 0x13d7aa260>, <boardgamegeek.objects.games.PlayerSuggestion object at 0x13d7a8c80>, <boardgamegeek.objects.games.PlayerSuggestion object at 0x13d7cca50>, <boardgamegeek.objects.games.PlayerSuggestion object at 0x13d7cdea0>, <boardgamegeek.objects.games.PlayerSuggestion object at 0x13d7cfb10>, <boardgamegeek.objects.games.PlayerSuggestion object at 0x13d7cd220>]","60","2.5253","summary of playthe moderator begins by selecting a secret rule and marking the card with the provided clips. always start with easy cards when there are new players. the moderator then creates the first two structures, using one or more pieces for each. one of these structures will follow the secret rule, and the other will not. if a structure follows the rule, it will be marked with a white token, and if not, it will be marked with a black token. players will then take turns, each time building a new structure, finding out if it follows the rule or not, and optionally making a guess at the secret rule. but to make an official guess, players must spend “guessing tokens,” which are earned by correctly predicting whether or not a new structure follows the secret rule.goalthe first player to correctly guess the secret rule wins!2examplesuppose the moderator chooses this rule card, and marks it as shown:the correct answer will then be that a structure must contain exactly two wedges. the moderator then builds and marks this pair of structures:next, the players will start formulating theories about what the rule could be.here are some of the possibilities the players might think of:• must contain only blue pieces.• must contain two pieces not touching.• must contain two pieces pointing in opposite directions.• must contain zero pyramids, or zero weird pieces.• must contain zero red pieces, or zero yellow pieces.• must contain at least one flat piece.the first player creates this structure, and says “tell”:it doesn’t follow the rule, so the moderator marks it with a black token.then the next player builds this structure, and says “quiz.” after everyone guesses, the moderator marks it with a white token. 3turn ordereach player’s turn has three phases:1) build a new structure2) choose “tell” or “quiz”3) make a guess, or pass1)  bu i ld  a n ew structurecreate a new structure using one or more pieces from the global supply. place it near the others, but not too near. you may arrange its pieces in any fashion, including leaning pieces against each other and stacked up in various ways.2 )  cho ose “te ll” or “quiz”tell: if you choose “tell,” the moderator will mark your new structure with a white or black token to indicate whether your structure follows or does not follow the hidden rule.quiz: if you choose “quiz,” all players must guess whether your new structure follows the rule or not. each player picks up their pair of answering tokens and hides their answer (black or white) in one fist. hold that fist out over the playing field, and wait for everyone else to do the same. when everyone is ready, all will reveal their guesses. the moderator will mark the structure with the correct answer, then they will award a guessing token to each player who answered the quiz correctly.3)  make   a  guess, or passpayment required: you can only make an official guess if you’ve earned a guessing token in a quiz. you may choose to spend one or more guessing tokens to try to guess the moderator’s rule, or you can pass and save up your guesses for later. to make a guess, hand a guessing token to the moderator, then state your guess as clearly as you can.clarify the guess: if the moderator does not fully understand your guess, or if it is ambiguous in some way, the moderator will ask clarifying questions until the uncertainty has been resolved. your guess is not considered to be official until both you and the moderator agree that it is official. at any time before that, you may retract your guess and take back your token, or you may change your guess. if any structure on the table contradicts your 4   guess, the moderator should point this out, and you may take back your token or change your guess. it is the moderator’s responsibility to make certain that a guess is unambiguous and is not contradicted by an existing structure. all players are encouraged to help the moderator with this process.moderator disproves guess: after you and the moderator agree upon an official guess, the moderator will disprove it, if possible. the moderator can disprove a guess in two ways: by building a structure which follows the rule but which your guess says does not, or by building a structure which does not follow the rule but which your guess says does.example: consider the game shown on page 3. suppose a player makes this guess: “the structure must contain at least one flat piece.” the moderator could disprove this guess in either of two ways: by building a structure, marked white, which contains no flat pieces, or by building a structure, marked black, that contains a flat piece. either of these possibilities will show you that the guess is incorrect. a common exchange tends to occur when a moderator sets up a counter-example:moderator: “according to your guess, would this structure follow the rule?”player: “yes.”moderator (marking the new structure with a black token): “well, in fact, it does not follow the rule.”option to repeat: once the moderator has built a counter-example and marked it appropriately, you may spend another guessing token, if you have one, to take another guess. you may spend as many of your guessing tokens as you wish during this portion of your turn. when you are finished, the action passes to the next player.","['Induction', 'Pattern Recognition', 'Simultaneous Action Selection']"
"2655","Abstract","Hive","2","2","2","[<boardgamegeek.objects.games.PlayerSuggestion object at 0x13d6ab0c0>, <boardgamegeek.objects.games.PlayerSuggestion object at 0x13d6a9770>, <boardgamegeek.objects.games.PlayerSuggestion object at 0x13d6abcf0>]","20","2.3145","game hive rules starting with white, players alternate turns performing a single bee is completely surrounded. the game ends in a draw if both queen bees are surrounded in the same turn, otherwise the player whose queen bee is surrounded loses the game. the game may also end in a draw if the players have exactly repeated the same position three times, or if it is mutually agreed upon. ) until a queen move​ or place​ (action​, pass​passing a player may  if and only if he can neither pass​ nore place​. move​placing a player may  a place​● the first white ● the first black ● subsequent  provided that the following rules are respected: bug​cellbug; it cannot be the queen bee  is placed in any ​​adjacent is placed in any bug​​; it cannot be the queen bee cell​ placements must satisfy the following conditions: bug​ must be placed in an bug○ the new empty to the adjacent​​​○ the new  of the opponent’s cell to a adjacent must not be bug​​​○ the queen bee must be placed at the latest during the fourth turn of a player hive color cell​moving a player may  a move​ provided that the following rules are respected: bug​● his queen bee has already been placed ● he’s using the movement ability (see below) or the  of one of his power​bugs basic movements  takes a step​a goes between two bordering cell from a source bug s to an ​​, l and r, which are the only cells​ destination adjacent​cells​cell d. this movement ​ to both s and d. adjacent​a  is a purely horizontal movement. it must satisfy the following conditions: crawl​● the height ’s bug​ is equal to d’s level​(otherwise the movement is not horizontal) ● either l’s  is less than or equal to the height​ or r’s height’s bug​​(otherwise the  is blocked by the gate formed by l and r) bug​ or l’s level’s bug or r’s height​​​ looses contact with the bug(otherwise the ​ is strictly greater than zero height​ while sliding) hive​level ● either the  is the combination of a purely vertical movement (during which the climba ​to the destination ’s cell​) and then a height​. crawl​’s bug​ increases to be equal level​ is the combination of a falla ​movement (during which the  (during which the crawl) and then a purely vertical level​​). height’s cell decreases to be equal to the destination level’s bug​​​​ stays at the same bug​  ​​​​  ​​​  ​​​​​​ ​​​​ ​ ​​​​​​  ​​​​  ​​​​​​​ ​ ​​​​​​​​​​​​​​​ ​​​​​​ ​​​​​​​​   movement abilities crawls ● ant: one or more ● beetle: one step ● grasshopper: one ● ladybug: one ● mosquito: it can copy the movement ability of an , then one climb​  or crawl​ in a straight line, over one or more jump, into an cellsoccupied​​​cell empty  into an fall​​ which is not covered bug​ atop an bug: it can behave like any non-mosquito ground​​, then one climb​adjacent​adjacent​○ if on the (if it is only adjacent to a mosquito then it cannot move) empty​cell stack ○ if not on the ● pillbug: it can either move itself or move another : it behaves like a beetle ground​ (which must be bug​ and on the adjacent​) ground​○ if moving itself: one ○ if moving another crawl ● queen bee: one ● spider: exactly three crawl crawls : one bug​ onto itself, then one climb​  into an fall​empty​cell restrictions covered cannot bug● a  and it cannot use its move​​​ cannot bugpinned● a  but it can use its move​​​● a  cannot bugresting and it cannot use its move​​​: during a sequence of ● no backtracking​notably, it cannot end the sequence in its starting power power power , the moving steps cannot enter a bug​​ (i.e. a null cell​ is not allowed) move​ it has already visited; cell​glossary ) cells​) occupied​bug level , place​adjacent​ or empty​ of its topmost color​ goes to a higher bug​ is the stack​: what a player can do during his turn (can be ● action or move) pass​​​● adjacent has six cell if they share a common side (a adjacent are cells: two ​​​​● bug: a game piece ​: a location in the virtual hexagonal grid on which the game is played (can be ● cell​ during which the : an ascending ● climbstep​​ of a non-empty color● color or cell: the ​​​ if it has one or more covered is bug: a ● covered on top of it bugs​​​​ during which the step: an horizontal ● crawl stays at the same bug​​​ is stack● empty if it does not contain any empty: a  or cell​​​​● fall during which the step: a descending ​​: the playing surface (a ● ground​bugs: the number of ● height in a ​​: all the ● hive already in play bugs​​ in which the move: a type of ● jump​​: the position of a ● level in its bug​​bug of moving a action● move: the  within the ​​​bugs  if it contains one or more occupied is cell: a ● occupied​​​ of not doing anything during a player’s turn action: the ● pass​​: a ● pinned if it is located at an articulation point (i.e. if removing it from the pinned is bug​​​ into multiple disconnected parts) hivesplit the ​ to another one (without cell goes directly from one bug​​ underneath it bugs counted as the number of stack​​ or a steps​ goes to a lower buglevel ​ zero) level is at ground​​ has a stackempty​​ (can be a sequence of hive​ on the bug​ (an stack​ of zero) height​bugs level ) jump​) steps​ would hive​ in play (i.e. from the player’s bug​: the ● place of putting a new action​​bug● power: a ’s special ability (for mosquito and pillbug) ​​: all the ● reserve​ that has moved (or has been moved) during a turn will be bug: a ● resting​​● stack: a group of zero or more ​: the atomic motion of a ● step​ that are not yet in play (each player has his own bugs​ occupying the same bugs​cell adjacent​ from one bug​ to an cell​ to the reserve​) hive​) reserve​ during the next turn resting​ during a cell​ (can be move​, crawl​ or climb​) fall​​​​​ ​​ ​​​​​​ ​​ ​​​​​ ​​​​​​​​​​ ​​​ ​ ​​​​ ​​​​ ​​​​​​​​ ​​​​​​​ ​​​​​​​​​​​​​​​​​​​​​​​​​​​​​​ ​​​​​​​​​​​​​​​​​​​​​​​​​​​​​​​​​​​​​ ​​​​","['Enclosure', 'Grid Movement', 'Hexagon Grid', 'Pattern Movement', 'Pieces as Map', 'Three Dimensional Movement', 'Tile Placement']"
"197405","Abstract","Tak","2","2","2","[<boardgamegeek.objects.games.PlayerSuggestion object at 0x13d78e5d0>, <boardgamegeek.objects.games.PlayerSuggestion object at 0x13d7a9310>, <boardgamegeek.objects.games.PlayerSuggestion object at 0x13d7a9e50>]","60","2.4416","gameplayon your turn you may either place a piece in an empty space, or move one of the stacks under your control.place: you can place a flat stone, a standing stone, or the capstone in any empty space on the board. (you never play a piece directly on another piece. stacks only form because of movement.)if you place your last piece, or if you fill the last space on the board, the game ends immediately.move: you can move one or more pieces in a stack that you control. a “stack” of pieces can be any height, including just one piece. “control” means that your piece is on top.to move the stack, take any number of pieces off the top, up to the carry limit, and move them in a straight line, dropping at least one piece off the bottom in each space along the way. the pieces that you drop will cover up any stacks that are already there.the simplest move is to take one piece and move it one space. taller stacks can move farther, dropping pieces as they go.additional movement rulescarry limit and stack height: there is no limit to the height of a stack, but there is a limit to the number of pieces that you can move. this “carry limit” is equal to the width of the board, so for example in a 5x5 game, you can carry no more than five pieces. that means if you start with a stack of 7, you must leave at least 2 of those pieces in the starting space.insurmountable pieces: standing stones and capstones cannot be covered, which means that all the spaces in your path must either be empty or contain flat stones.flattening walls: a capstone can, by itself, move onto a standing stone and flatten it. the capstone may be part of a larger stack that is making a longer move, as long as the final step (crushing the wall) is done by the capstone alone. aside from flattening it with a capstone, you cannot lay down a wall.basic strategymovement is the key to the game. a tall stack has many options and a long move can seriously change the balance of power.be careful not to make moves too early, you need to get pieces into play, and not just move the pieces you already have. in the late game, don’t be afraid to “run out the clock” and run out of pieces if you’re ahead on the flats!moving a tall stack example:white controls this stack, with a standing stone on top.assuming that this is a 5x5 board, the carry limit is five. that means white is allowed to move this entire stack of five pieces, or she could choose to leave some behind.moving in a straight line, white must drop at least one piece in each space. these pieces come off the bottom of the stack.in the first space, she leaves two pieces. on the second space, she leaves two pieces again.the standing stone, by itself, goes into the last space. the end result is shown in the last step.this single move has given white control of three spaces that just belonged to black!","['Grid Movement', 'Network and Route Building', 'Square Grid']"
"329002","Abstract","CULTivate","2","5","4","[<boardgamegeek.objects.games.PlayerSuggestion object at 0x13d6e0870>, <boardgamegeek.objects.games.PlayerSuggestion object at 0x13d6e34d0>, <boardgamegeek.objects.games.PlayerSuggestion object at 0x13d6c8050>, <boardgamegeek.objects.games.PlayerSuggestion object at 0x13d6ca530>, <boardgamegeek.objects.games.PlayerSuggestion object at 0x13d6cbb60>, <boardgamegeek.objects.games.PlayerSuggestion object at 0x13d6cb9d0>]","50","1.3636","playing the gameon a playerʼs turn, the player will choose one of the following actions:play a card from their hand, then draw a replacement card to replenish their hand.discard any number of cards, then draw an equal number of new cards to replenish their hand.make an exchange following the exchange rules (see follower exchanges on page 6).if there are no cards in the draw pile, shuffle the discard pile to replenish it. when drawing multiple cards from the draw pile be sure to draw them 1 at a time. this is important for cases where a player draws both an undercover investigation and a political influence card (see special card references on page 8).3character agendasany player who has their agenda completed when the game ends earns bonus points as indicated on the card. an agenda isaccomplished by placing specific types of followers in a playerʼs compound to match the pattern selected on their character agenda mat. a player may only work toward accomplishing one agenda during a game. when an agenda is completed during game play, it can still be lost through stealing, exchanges, swaps, or switches. agendas for: pierre ahmed skeemlotion upagenda value: 8 ptsconvince your celebrity followers to promote your brand to top investors on wall street in order to send your stock prices through the roof.no common scentsagenda value: 10 ptsenlist academic and scientist followers to create a mind-altering fragrance for your necessary lotions. this concoction will help you control your followers, the skin care market, and eventually, the world!dress to oppressagenda value: 12 ptsturn your rough-and-tumble drifters into youthful, beautiful looking citizens by giving them a full-makeover and new wardrobe. then send them out to pedal your products door to door. agenda diagrammarker cube placementagenda valuefollower key3 points2 points1 point4 pointscelebritypoliticianscientistacademicactivistdrifteryouthinvestigatorfollowersa player is limited to only a finite number of followers they can recruit. if the followers a player wants have already joined an opponentʼs cult, they will need to convert them or force a deal with another cult leader. a player can also make exchanges to get the followers they need if they donʼt draw the right cards!celebrity: 3 ptspolitician: 3 ptsscientist: 2 ptsacademic: 2 ptsactivist: 1 ptsdrifter: 1 ptyouth: 1 ptinvestigator: - 4 ptsfollower placementfollowers must always be added to compounds starting in the top row and moving downward through the compound. followers may be placed in any column as long as they are always placed in the top-most empty square in the column. in some cases, exchanges or steals may result in an empty space with followers already placed below it. a player must always refill the top-most empty space before continuing down the column.if a follower is stolen or exchanged away, the top-most available space must be filled before continuing down that column.investigatorswhile cultivating followers, a player may gain unwanted investigators in their compounds. investigators are undercover in your cult, so they are considered followers. these investigators stop any followers, including other investigators, from being placed below them. investigators can be placed on any space no matter the color, however, they must still be placed in the top-most available space in a column. there is no limit to the number of investigators a player can have in their compound. investigators remaining in a playerʼs compound at the end of the game are each worth -4 pointsexamples:the investigator stops any followers from being placed below it until it has been removed from the compound.investigators can be placed in any space, no matter the color.this move is invalid. investigators must still be placed in the top-most available space.this move is invalid. an investigator cannot be placed below another investigator.5removing investigatorsinvestigators can be removed from a playerʼs compound by performing the following actions:exchangegiving up 4 points worth of followers to remove an investigator from the compound (blackmail power can lower this to 2 points).cardsplaying the cards sabotage a rival or force a deal to moveinvestigators to an opponentʼs compound. (assign a new task can also help to move investigators within a playerʼs own compound.)follower exchangesmove 1 investigator from any player’scompound to another compoundswap a follower withanother playeras an action, a player may choose to exchange followers from their compound with followers from the supply. after an exchange is made, acquired followers must be placed in the playerʼs compound following normal placement rules. only one exchange may be made per turn, unless the manipulate power has been activated (see powers on page 7). there are 4 types of exchanges as follows:one for oneexchange one follower from your compound for one follower of a different type ofequal point value.example:=22one for multipleexchange one follower from your compound for any combination of followers equalingthe same point value.example:3= 2multiple for oneexchange any combination of followers from your compound for one follower of equalpoint value.example:21=13remove investigatorexchange any combination of followers equal to four points from your compound toremove an investigator. both the followers and investigator are removed in this typeof exchange.example:211=there may be times that you may want to make a one for multiple exchange where you are unable to gain back an equal value of points. this is allowed. for example, exchanging a 3 point celebrity and only gaining a 2 point scientist because there are no 1 point followers left in the supply.investigator insightsmaking exchanges can help you fulfill your agenda or fill color-specific spaces when you are struggling to gain the right type of followers. exchanges can also help you remove investigators to avoid negative points at the end of the game.6locked spaceseach compound board has 4 colored spaces in the bottom row. these spaces allow a player to gain powers to help them fill their compound and accomplish their agenda. only followers matching the color/symbol of the space may be placed in the bottom row with the exception of the investigator, which may be placed in any space. once a follower of the correct color is placed in a colored space it is locked in and cannot be moved by any player including the player who placed it. when a player fills a locked space, the corresponding power is immediately in effect and cannot be lost. an investigator in a locked space does not allow powers to be in effect and can still be moved.this move is invalid. the follower placed in the locked space must always match the color of the space they are on.an investigator in a locked space does not allow the power to be in effect, and it can still be moved.there is no follower in the locked space. the power is not in effect.the column is filled, and the correct type of follower is in the locked space. the columnʼs power is active and the follower in the locked space may not be moved.powerspowers are listed on compound boards under their corresponding locked space. powers are used on a playerʼs turn as part of their action. powers immediately take effect when a locked space is filled (locked spaces with investigators are not considered filled). powers can never be lost.hijackmastermindif this space is filled at the end of the game, the player adds 2 additional bonus points to their score.when this power is gained, immediately draw an additional card to increase your hand size from 4 cards to 5. manipulateblackmailon their turn, a player with this power may make up to 2 exchanges per turn. this does not allow a player to take 2 different actions per turn. you may only make another exchange if you have already made an exchange.when making an exchange to remove an investigator from their compound, a player with this power only need to remove 2 points worth of followers rather than 4 points. investigator insightsyour power is in effect immediately when a locked spaced becomes filled. for example, if you use an exchange to fill the manipulate locked space, you gain that power immediately, and can perform a second exchange that same turn.7","['Card Play Conflict Resolution', 'End Game Bonuses', 'Grid Coverage', 'Pattern Building', 'Take That', 'Variable Set-up']"
