"id","category","name","min_players","max_players","average_player_suggestions","player_suggestions","playing_time","rating_average_weight","how to play","mechanics"
"202977","Educational","Cytosis: A Cell Biology Board Game","2","5","4","[<boardgamegeek.objects.games.PlayerSuggestion object at 0x13d6c9b80>, <boardgamegeek.objects.games.PlayerSuggestion object at 0x13d6cb110>, <boardgamegeek.objects.games.PlayerSuggestion object at 0x13d6cb070>, <boardgamegeek.objects.games.PlayerSuggestion object at 0x13d6c8910>, <boardgamegeek.objects.games.PlayerSuggestion object at 0x13d6c9a90>, <boardgamegeek.objects.games.PlayerSuggestion object at 0x13d6c9220>]","90","2.4308","gameplay overview cytosis is played in rounds, each with two phases: 1.  phase 1 – flask placement: players place flasks to collect resources, take actions, and complete cell component cards to earn health points. 2.  phase 2 – event card & board refresh: reveal an event card and refresh the board. the game continues until the last event card is revealed. one final round is played, then players tally final health points. phase 1 – flask placement •  turn order: the player with the first player marker goes first; turns proceed clockwise. •  on your turn: 1.  place one flask on an available spot. 2.  immediately collect resources or perform the action on that spot. •  alternative action: instead of placing a flask, a player may collect 1 mrna, lipid, or atp by exhausting a flask. exhausted flasks cannot be used again that round. •  restrictions: o  only one flask per spot. o  once occupied, a spot is unavailable until the next round. flask placement spots 1.  collecting resources o  nucleus (dna transcription): collect 2–3 mrna (black). o  plasma membrane (glucose transporter): spend atp to collect carbohydrate (green). o  mitochondria (atp production): collect 2–6 atp (may need to pay carbohydrate for max 6 atp). o  smooth er (lipid synthesis): collect 2–3 lipid (yellow). o  free ribosome (mrna translation): trade black mrna for protein (red). 2.  purchasing cell component cards o  pay atp cost indicated on the card. o  collect the card below the flask into your hand. 3.  completing cell component cards   o  smooth er: alcohol detox or steroid hormone synthesis using transport vesicles. o  rough er: protein hormone, protein hormone receptor, or steroid hormone receptor cards using transport vesicles. o  golgi apparatus: add carbohydrate or lipid to transport vesicles; move vesicles from er to golgi. o  plasma membrane (exocytosis): reveal card, pay atp, return resources, and gain health points. o  cytoplasm: complete enzyme cards; pay atp and resources, then gain health points. 4.  first player marker o  laureates in biology spot: take the first player marker. o  option: take 1 atp or place a goal marker on an available goal card. o  first goal marker placement = 3 health points immediately. 5.  grey flasks o  pay 4 atp to place a grey flask in any spot (even occupied) and perform its action. o  only one grey flask per turn. phase 2 – event card & board refresh 1.  retrieve flasks: return your flasks; keep transport vesicle disks and resources on the board. 2.  reveal event card: only the new card is active; old cards become inactive. 3.  refresh cell component cards: o  remove left-most card; discard it. o  slide remaining cards left. o  fill empty spots from the deck. shuffle discard pile if deck is empty. event cards 1.  toxicity: players return macromolecules to the general stock if exceeding thresholds. o  ≥5 = lose 1, ≥7 = lose 2, ≥10 = lose 4. 2.  boost: add 1 resource to a board area; first player to place there gets it free. 3.  reduce atp cost: reduce atp cost of card purchases by 1; taking a free spot also gives 1 atp. cell component cards •  types: 1.  hormone cards (protein/red or steroid/blue) 2.  hormone receptor cards 3.  enzyme cards    4.  alcohol detoxification cards 5.  additional resource cards •  hand & completed cards: keep cards in hand secret until completed; completed cards face-up for scoring. hormone cards •  completed over multiple turns: er → golgi → plasma membrane. •  place transport vesicle disks and required macromolecules. •  gain health points after exocytosis. example – protein hormone card: 1.  rough er: place vesicle, trade mrna → protein. 2.  golgi: move vesicle, add carbohydrate. 3.  plasma membrane: move vesicle out, pay atp, return macromolecules, gain health points. hormone receptor cards •  complete like hormone cards. •  score extra when opponents complete corresponding hormones. enzyme cards •  free ribosome → cytoplasm. •  trade mrna → protein, pay atp, pay resources. •  sets of unique enzymes give extra end game points. alcohol detoxification cards •  smooth er: pay atp, gain 1 health. •  end game: most alcohol detox cards = additional points. additional resource cards •  play anytime: gain indicated resources immediately. goal cards •  place goal markers via laureates in biology spot. •  during game: first marker = 3 health points; second = none. •  end game: score points for completed cell component cards on that goal card. ","['Set Collection', 'Worker Placement']"
"266192","Educational","Wingspan","1","5","4","[<boardgamegeek.objects.games.PlayerSuggestion object at 0x13d7cd0e0>, <boardgamegeek.objects.games.PlayerSuggestion object at 0x13d7aaf80>, <boardgamegeek.objects.games.PlayerSuggestion object at 0x13d7abd90>, <boardgamegeek.objects.games.PlayerSuggestion object at 0x13d7a81e0>, <boardgamegeek.objects.games.PlayerSuggestion object at 0x13d7ab5c0>, <boardgamegeek.objects.games.PlayerSuggestion object at 0x13d7abed0>]","70","2.4752","play a bird” action to play a bird into the specific habitat. a bird that uses its power to move into the habitat does not trigger this power.when activated: gain 1 supply and cache it on this card. from the when activated: gain 1 birdfeeder (if available). you may cache it on this card.  from the once betweeen turns: when another player takes the “gain food” action, if they gain any number of from the supply and cache it on this card., also gain 1 the birds with these powers are known for caching extra food and saving it for later. as noted on these cards, you can cache exactly 1 food token when their power is activated by placing it on a bird card. once a food token is cached on a bird card, you cannot spend it. each token on the card at ","['Action Queue', 'Dice Rolling', 'End Game Bonuses', 'Hand Management', 'Once-Per-Game Abilities', 'Open Drafting', 'Set Collection', 'Solo / Solitaire Game', 'Turn Order: Progressive']"
"391163","Educational","Forest Shuffle","2","5","4","[<boardgamegeek.objects.games.PlayerSuggestion object at 0x13d6a9950>, <boardgamegeek.objects.games.PlayerSuggestion object at 0x13d6abe80>, <boardgamegeek.objects.games.PlayerSuggestion object at 0x13d6abca0>, <boardgamegeek.objects.games.PlayerSuggestion object at 0x13d6a9860>, <boardgamegeek.objects.games.PlayerSuggestion object at 0x13d6a90e0>, <boardgamegeek.objects.games.PlayerSuggestion object at 0x13d6aa210>]","60","2.2067","game flowbeginning  with  the  start  player,  everyone  takes  turns  in  clockwise  order.  on  your  turn,  you  must carry out exactly one of two possible actions:a)  draw two cardsfor each card, you may choose to take it from the deck or the clearing.orb)  play a card and check the clearingpay the card’s cost, place it in your forest, and perform its effect and bonus, if any. then check if the clearing needs to be emptied.2buntspecht: jede dieser karten bringt dir nur dann 10 punkte, falls du den wald mit den meisten bäumen, inkl. baumsprösslingen, hast (auch bei gleichstand).damhirsch: jede dieser karten bringt dir 3 punkte pro paaarhufer  in deinem wald (inkl. dem damhirsch selbst).eiche: jede dieser karten bringt dir nur dann 10 punkte, falls du 8 unterschiedliche bäume hast (ohne baumsprössling).  eichhörnchen: jede dieser karten bringt dir nur dann 5 punkte, falls sie oben an einer eiche liegt.169mistkäfer: jede dieser karten bringt dir 1 punkt pro pfote  in deinem wald.moos: jede dieser karten bringt dir nur dann 10 punkte, falls sich mind. 10 bäume (inkl. baumsprösslingen) in deinem wald beﬁ nden.mopsﬂ edermaus: jede dieser karten bringt dir nur dann 5 punkte, falls sich mind. 3 unterschiedliche fledermäuse (inkl. dieser) in deinem wald beﬁ nden.parasol: du ziehst die karte erst nachdem du die ausgespielte karte bezahlt hast. der parasol bringt dir keine punkte. 174wildkaninchen: kann sich mit beliebig vielen anderen wildkaninchen den platz an einem baum teilen. jede einzelne wildkaninchenkarte bringt dir so viele punkte, wie du wild-kaninchen irgendwo in deinem wald hast. bsp.: du hast 5 wildkaninchen in deinem wald. dafür bekommst du insg. 25 punkte.wildschwein: jede dieser karten bringt dir nur dann 10 punkte, falls sich mind. 1 frischling in deinem wald beﬁ ndet.bsp: du hast 1 frischling und 2 wildschweine in deinem wald. damit ist jedes wildschwein 10 punkte wert (also insg. 20 punkte). wolf: jede dieser karten bringt dir 5 punkte pro hirsch  in deinem wald. 180laubfrosch: jede dieser karten bringt dir 5 punkte pro stechmücke in deinem wald.linde: jede dieser karten in deinem wald bringt dir 1 punkt oder stattdessen 3 punkte, falls du den wald mit den meisten linden hast (auch bei gleichstand).luchs: jede dieser karten bringt dir nur dann 5 punkte, falls sich mind. 1 reh in deinem wald beﬁ ndet. bsp: du hast 1 reh und 2 luchse in deinem wald. damit ist jeder luchs 5 punkte wert (also insg. 10 punkte).maulwurf: nutze den effekt des maulwurfs, nachdem du ihn bezahlt hast. lege zunächst alle karten, die du über ihn spielen möchtest, aus, bezahle die karten und nutze dann ggf. ihre effekte und boni.173erdkröte: darf sich mit höchstens einer anderen erdkröte den platz an einem baum teilen. jede einzelne erdkrötenkarte bringt dir nur dann 10 punkte, falls sie sich mit einer anderen erdkröte den platz teilt.feuersalamander: sie werden als set gewertet: 1/2/3 dieser karten in deinem wald bringen dir zusammen entsprechend 5/15/30 punkte.fliegenpilz: du ziehst die karte erst nachdem du die pfoten-karte  bezahlt hast. der fliegenpilz bringt dir keine punkte.170mistkäfer: jede dieser karten bringt dir 1 punkt pro pfote  in deinem wald.moos: jede dieser karten bringt dir nur dann 10 punkte, falls sich mind. 10 bäume (inkl. baumsprösslingen) in deinem wald beﬁ nden.mopsﬂ edermaus: jede dieser karten bringt dir nur dann 5 punkte, falls sich mind. 3 unterschiedliche fledermäuse (inkl. dieser) in deinem wald beﬁ nden.parasol: du ziehst die karte erst nachdem du die ausgespielte karte bezahlt hast. der parasol bringt dir keine punkte. 174braunes langohr: jede dieser karten bringt dir nur dann 5 punkte, falls sich mind. 3 unterschiedliche fledermäuse (inkl. dieser) in deinem wald beﬁ nden.brombeeren: jede dieser karten bringt dir 2 punkte pro pﬂ anze  in deinem wald (inkl. den brombeeren selbst).buche: jede dieser karten bringt dir nur dann 5 punkte, falls sich mind. 4 buchen in deinem wald beﬁ nden.buchﬁ nk: jede dieser karten bringt dir nur dann 5 punkte, falls sie oben an einer buche liegt.168ahorn: jede dieser karten bringt dir so viele punkte, wie sich bäume (inkl. baumsprösslingen) in deinem wald beﬁ nden.baumfarn: jede dieser karten bringt dir 6 punkte pro amphibie  in deinem wald.bechsteinﬂ edermaus: jede dieser karten bringt dir nur dann 5 punkte, falls sich mind. 3 unterschiedliche fledermäuse (inkl. dieser) in deinem wald beﬁ nden.braunbär: nutze den effekt, nachdem du den braunbären bezahlt hast. der braunbär selbst bringt dir keine punkte, aber du bekommst punkte für karten in der höhle.167a)  drawing two cards when taking this action, draw two cards, one at a time, and add them to your hand. for each card you draw with this action, you have the choice of either taking a face-down card from the top of the deck or a face-up card from the clearing (which is empty at the start of the game).important:  you are limited to 10 cards in hand. if you have 9 cards in your hand, you may only draw one card.960winter cardsthe lower third of the deck contains 3 winter cards. when you draw a winter card, you must place it face up next to the clearing and immediately draw a replacement card from the deck. when the third winter card is drawn, the game ends immediately.winter is comingif this is the 3rd winter card,the game ends immediately.otherwise, place this card next to theclearing and draw a new card from the deck.b) playing a card and checking the clearingeach card has either one tree or two forest dwellers:•  each tree card features exactly one type of tree, around which you can place animals, plants, and mushrooms. trees are the basis of your forest.•  all other cards are split in two: either horizontally, featuring one forest dweller on the top and another on the bottom, or vertically, featuring one each on the left and right.all cards are laid out as follows:costtype symboleffect (on some cards)illustration711tawny owl point valuenamecard color with tree symbolstag beetlethe number of this species that exist in the gamebonus (on some cards)3playing a cardto play a card from your hand, you must first pay its cost by placing that many (other) cards from your hand face up into the clearing. when playing a split card, choose one half to play and pay only its cost.normally, it does not matter which cards you discard as payment. some species, however, provide a bonus if you pay with specific cards (see “bonus” on page 6).then, place the card face up in fron of yourself. your collection of played cards is called your forest.note: split cards must always be placed next to a tree (see below). the total of your played cards constitutes your forest.treestrees provide card slots for split cards on each of their four sides: top, bottom, left, and right. as long as there is no card played to a card slot, it is considered empty; a tree is considered fully occupied if there is at least one card on each of its four sides.top450leftrightwhenever you play a tree, you must also draw the top card from the deck and place it face up in the clearing. a symbol on the clearing  reminds you of this rule during the game.   douglas firbottomnote: this may cause a winter card to be revealed. if it does, proceed as described on page 3.321example: 1  1. you wish to play a sycamore tree, which costs . 6402  to  pay  for  it,  you  place  two  cards from your hand face-up in the clea-ring.3  because  you  played  a  tree,  you  now also  place  the  top  card  of  the  deck face up into the clearing.sycamore4linden– or –if no other forest has more lindens001oakif all 8 tree species are in your forest012sycamore046wolfgnatany number098camberwell beautydifferentbutterﬂ iespond turtle120if at leastbarbastelle batdifferent3if at least 1 squeakerwild boar078large tortoiseshelldifferentbutterﬂ iesfire salamander121douglas fir053tree saplinginstead  of  playing  a  tree,  you  may  play  any  card  from  your  hand  face  down  as  a universal  tree  sapling.  like  a  tree,  a  tree  sapling  provides  a  card  slot  on  each  of its four sides. however, it does not belong to any of the eight tree species and is not considered a tree species of its own.animals, plants, and mushroomsthe split cards feature varying inhabitants of the forest: animals, plants, or mushrooms.when playing a split card, you must place it in an empty slot on the corresponding side of a tree in your forest. if you wish to play an inhabitant on the left side of a card, it must be placed on the left side of a tree; to do so, slide the unused right half of the card under the tree. the same rules apply to inhabitants on the right, top, or bottom halves of cards.note: only the inhabitant that is still visible after the card has been placed counts as being in your forest. the hidden half is not relevant for the remainder of the game or for scoring.501640example: you have just added this squeaker to your forest by sliding the right half of the card under the sycamore tree.squeakerred deersycamorenote: split cards can only be played if one of your trees has an empty card slot available on the corresponding side.effect and bonusif the card you just played has an effect or bonus (or both), you may now use them. if you wish to use both, you must use the effect before using the bonus. using an effect or bonus is optional.card effects and bonuses are explained with either icons or short descriptions. you can find an overview of all symbols on the last page of this rulebook. if you would like a more detailed explanation, consult the reference cards or the digital appendix (see qr code).appendix5effectsthere are two types of effects:061•  most cards provide an instant effect that can be used once immediately after playing it.•  mushrooms,  however,  provide  a  permanent  effect,  which  you  can  use  for  the  rest  of  the chaffi  nchgame, beginning on your next turn.if on a beechmushroomsmushrooms  have  an  effect  when  certain  cards  are  placed  in  your forest  (e.g.,  below  a  tree).  each  time  you  place  such  a  card  in  your forest, you may use the mushroom’s effect immediately.parasol mushroomwhenever you play a card below a tree:example: you have just played a parasol mushroom. starting on your next turn, whenever you place a card in a card slot below a tree, you may draw the top card from the deck.980bonus some species have a colored arrow featuring the  symbol, providing a bonus if you pay for the card with matching cards: to activate the bonus, all cards that you discard as payment must have the same card color (i. e., show the same tree symbol) as the card being played. when paying with split cards, it does not matter which half of the card shows the matching tree symbol.040980980731731030030fallow deerroe deerfallow deerroe deerbeechif there are at least 4 beeches in your foresteurasian jayeurasian jaybirchfireﬂ ies1eurasian jayeurasian jaylindenfireﬂ ies– or –if no other forest has more lindens7733111001002example: you play a roe deer into your forest.1  to activate the bonus, you pay with an eurasian jay and a birch tree. both cards have the same color (and show a birch symbol) as the roe deer.2  if you paid with a linden tree instead of a birch tree, you would not activate the bonus. lindenfallow deerroe deerchecking the clearingfireﬂ ies– or –if no other forest has more lindensat the end of your turn, if there are 10 or more cards in the clearing, the clearing must be emptied. remove all cards from the clearing and return them to the game box.birchfireﬂ iesthen your turn ends, and the next player clockwise takes their turn unless an effect or bonus allows you to take another turn.6chaffi  nchif on a beechparasol mushroomwhenever you play a card below a tree:160linden– or –if no other forest has more lindens001","['End Game Bonuses', 'Hand Management', 'Layering', 'Melding and Splaying', 'Multi-Use Cards', 'Open Drafting', 'Set Collection', 'Tags']"
"1111","Party game","Taboo","4","10","6","[<boardgamegeek.objects.games.PlayerSuggestion object at 0x13d78d1d0>, <boardgamegeek.objects.games.PlayerSuggestion object at 0x13d78c8c0>, <boardgamegeek.objects.games.PlayerSuggestion object at 0x13d7aa760>, <boardgamegeek.objects.games.PlayerSuggestion object at 0x13d7a9b80>, <boardgamegeek.objects.games.PlayerSuggestion object at 0x13d7aaa80>, <boardgamegeek.objects.games.PlayerSuggestion object at 0x13d7aa620>, <boardgamegeek.objects.games.PlayerSuggestion object at 0x13d7ce0d0>, <boardgamegeek.objects.games.PlayerSuggestion object at 0x13d7cdfe0>, <boardgamegeek.objects.games.PlayerSuggestion object at 0x13d7cd680>, <boardgamegeek.objects.games.PlayerSuggestion object at 0x13d7ce210>, <boardgamegeek.objects.games.PlayerSuggestion object at 0x13d7cf430>]","20","1.2006","playteams take turns playing, so decide which team goes first!on your team’s turnpick someone to be the describer and give them a stack of cards. everyone else will guess.+12someone from the other team grabs the squeaker and peers over the describer’s shoulder. they’ll squeak if the describer breaks any rules.(see back page for details!) 34start the timer! describer, flip a card  and describe the guess word, avoiding the taboo words.•  if your team says the guess word, put that card to the side as a point. if you get squeaked or decide to skip, set that card to the other side.• keep flipping cards and describing words until time runs out!now, tally up the points: •  score 1 point for each card your team guessed correctly. give 1 point  to the other team for each card squeaked or skipped.• now the other team plays! make sure teams switch  up the describer each round.5x7”   4c 2 sided e26160790_taboo_i.indd   1e26160790_taboo_i.indd   1front1/21/21   4:07 pm1/21/21   4:07 pmwhen to squeak!squeak if the describer breaks any of these rules:•  don’t say any part of any word on the card.  (e.g., you can’t say “space” or “ship” if the word is “spaceship.”)•  no sneaky plurals or abbreviations.  (e.g., you can’t say “feet” for “foot” or “tv” for “television.”)•   no gestures, noises, or sound effects. you’re free to sing, though!•   no “sounds like,” “rhymes with,” or “starts with the letter”—c’mon, that’s too easy!","['Communication Limits', 'Team-Based Game']"
"271601","Party game","Feed the Kraken","5","11","6","[<boardgamegeek.objects.games.PlayerSuggestion object at 0x13d6cb0c0>, <boardgamegeek.objects.games.PlayerSuggestion object at 0x13d6c8690>, <boardgamegeek.objects.games.PlayerSuggestion object at 0x13d6cbf20>, <boardgamegeek.objects.games.PlayerSuggestion object at 0x13d6ca800>, <boardgamegeek.objects.games.PlayerSuggestion object at 0x13d6aa490>, <boardgamegeek.objects.games.PlayerSuggestion object at 0x13d6a9ae0>, <boardgamegeek.objects.games.PlayerSuggestion object at 0x13d6ab4d0>, <boardgamegeek.objects.games.PlayerSuggestion object at 0x13d6abfc0>, <boardgamegeek.objects.games.PlayerSuggestion object at 0x13d72d6d0>, <boardgamegeek.objects.games.PlayerSuggestion object at 0x13d72d4a0>, <boardgamegeek.objects.games.PlayerSuggestion object at 0x13d72e9e0>, <boardgamegeek.objects.games.PlayerSuggestion object at 0x13d72df90>]","90","2.1429","gameplay 1.  appointing the navigation team o  captain appoints lieutenant and navigator (cannot be off-duty or themselves). 2.  a question of loyalty (mutiny) o  crew can challenge captain’s choices using guns. o  required guns for successful mutiny: players required guns 3 5–7 8–9 4 10–11  5 •  successful mutiny determines new captain; tied players are resolved sequentially. 3.  navigation o  captain draws 2 cards, lieutenant discards 1, navigator chooses 1 card to execute. o  denial of command: navigator may jump overboard; emergency navigation occurs. o  execute card effects: move ship, take map action, perform card action. 4.  off-duty o  navigator and lieutenant badges return to captain. o  off-duty signs prevent selection in next round. 5.  next round o  repeat phases. o if draw pile < 4 cards, reshuffle discard pile. map actions •  cabin search: captain inspects a player’s seabag. player can no longer become a cultist. •  off with the tongue: player cannot speak or become captain. •  flogging: publicly shows a faction the player does not belong to. •  mermaid: inspect last 3 discarded navigation cards. •  telescope: look at top navigation card. •  armed / disarmed: adjust gun count. •  cult uprising: trigger cult ritual card effect. •  feed the kraken: player eliminated; if cult leader, cult wins immediately. cult ritual cards •  guns stash: cult leader distributes 3 guns secretly. •  cult cabin search: reveals navigation team factions secretly.   •  conversion to cult: cult leader secretly converts a player into cultist. players already inspected (cabin search or flogging) cannot be converted. character cards •  each player gets one facedown. •  can be revealed strategically to gain unique effects. •  some cards have timing restrictions; recurring/ongoing effects are explained on the card. strategy advice •  pirates: bluff as sailors; act strategically to help cult or steer ship west. •  cult leader: balance travel direction, convert trusted players, create distrust. •  sailors: stick to truth, find allies, expose threats quickly. ","['Acting', 'Betting and Bluffing', 'Grid Movement', 'Hidden Roles', 'Player Elimination', 'Role Playing', 'Roles with Asymmetric Information', 'Team-Based Game', 'Traitor Game', 'Variable Player Powers', 'Voting']"
